{
  "schema_version": 1,
  "generated_at": "2026-10-13T10:40:22.709574+00:00",
  "success_threshold": 6.0,
  "details": [
    {
      "strategy": "full_rewrite",
      "version": "early",
      "run_id": 20,
      "task_idx": 142,
      "tf": 10.0,
      "pe": 5.8,
      "ecs": 10.0,
      "success": true,
      "failure_category": "",
      "prompt_tokens": null,
      "completion_tokens": null,
      "wall_clock_s": 1079.541,
      "task_status": "affected",
      "model": "gpt-4o-mini",
      "judge": "gpt-4o-mini",
      "mcp_status_at_start": {
        "observed_servers": 26,
        "connected_servers": 26,
        "available_tools": 304
      }
    },
    {
      "strategy": "full_rewrite",
      "version": "early",
      "run_id": 20,
      "task_idx": 144,
      "tf": 10.0,
      "pe": 2.4,
      "ecs": 10.0,
      "success": true,
      "failure_category": "",
      "prompt_tokens": null,
      "completion_tokens": null,
      "wall_clock_s": 1079.541,
      "task_status": "affected",
      "model": "gpt-4o-mini",
      "judge": "gpt-4o-mini",
      "mcp_status_at_start": {
        "observed_servers": 26,
        "connected_servers": 26,
        "available_tools": 304
      }
    },
    {
      "strategy": "full_rewrite",
      "version": "early",
      "run_id": 20,
      "task_idx": 161,
      "tf": 5.6,
      "pe": 2.4,
      "ecs": 4.4112159422448105,
      "success": false,
      "failure_category": "unknown",
      "prompt_tokens": null,
      "completion_tokens": null,
      "wall_clock_s": 1079.541,
      "task_status": "retention",
      "model": "gpt-4o-mini",
      "judge": "gpt-4o-mini",
      "mcp_status_at_start": {
        "observed_servers": 26,
        "connected_servers": 26,
        "available_tools": 304
      }
    },
    {
      "strategy": "full_rewrite",
      "version": "early",
      "run_id": 20,
      "task_idx": 2,
      "tf": 10.0,
      "pe": 5.2,
      "ecs": 10.0,
      "success": true,
      "failure_category": "",
      "prompt_tokens": null,
      "completion_tokens": null,
      "wall_clock_s": 1079.541,
      "task_status": "affected",
      "model": "gpt-4o-mini",
      "judge": "gpt-4o-mini",
      "mcp_status_at_start": {
        "observed_servers": 26,
        "connected_servers": 26,
        "available_tools": 304
      }
    },
    {
      "strategy": "full_rewrite",
      "version": "early",
      "run_id": 20,
      "task_idx": 218,
      "tf": 4.0,
      "pe": 5.8,
      "ecs": 4.0,
      "success": false,
      "failure_category": "unknown",
      "prompt_tokens": null,
      "completion_tokens": null,
      "wall_clock_s": 1079.541,
      "task_status": "affected",
      "model": "gpt-4o-mini",
      "judge": "gpt-4o-mini",
      "mcp_status_at_start": {
        "observed_servers": 26,
        "connected_servers": 26,
        "available_tools": 304
      }
    },
    {
      "strategy": "full_rewrite",
      "version": "early",
      "run_id": 20,
      "task_idx": 235,
      "tf": 10.0,
      "pe": 7.0,
      "ecs": 10.0,
      "success": true,
      "failure_category": "",
      "prompt_tokens": null,
      "completion_tokens": null,
      "wall_clock_s": 1079.541,
      "task_status": "retention",
      "model": "gpt-4o-mini",
      "judge": "gpt-4o-mini",
      "mcp_status_at_start": {
        "observed_servers": 26,
        "connected_servers": 26,
        "available_tools": 304
      }
    },
    {
      "strategy": "full_rewrite",
      "version": "early",
      "run_id": 20,
      "task_idx": 246,
      "tf": 8.8,
      "pe": 5.2,
      "ecs": 9.034314575050763,
      "success": true,
      "failure_category": "",
      "prompt_tokens": null,
      "completion_tokens": null,
      "wall_clock_s": 1079.541,
      "task_status": "affected",
      "model": "gpt-4o-mini",
      "judge": "gpt-4o-mini",
      "mcp_status_at_start": {
        "observed_servers": 26,
        "connected_servers": 26,
        "available_tools": 304
      }
    },
    {
      "strategy": "full_rewrite",
      "version": "early",
      "run_id": 20,
      "task_idx": 249,
      "tf": 10.0,
      "pe": 3.6,
      "ecs": 10.0,
      "success": true,
      "failure_category": "",
      "prompt_tokens": null,
      "completion_tokens": null,
      "wall_clock_s": 1079.541,
      "task_status": "retention",
      "model": "gpt-4o-mini",
      "judge": "gpt-4o-mini",
      "mcp_status_at_start": {
        "observed_servers": 26,
        "connected_servers": 26,
        "available_tools": 304
      }
    },
    {
      "strategy": "full_rewrite",
      "version": "early",
      "run_id": 20,
      "task_idx": 260,
      "tf": 7.6,
      "pe": 2.6,
      "ecs": 7.599999999999999,
      "success": true,
      "failure_category": "",
      "prompt_tokens": null,
      "completion_tokens": null,
      "wall_clock_s": 1079.541,
      "task_status": "retention",
      "model": "gpt-4o-mini",
      "judge": "gpt-4o-mini",
      "mcp_status_at_start": {
        "observed_servers": 26,
        "connected_servers": 26,
        "available_tools": 304
      }
    },
    {
      "strategy": "full_rewrite",
      "version": "early",
      "run_id": 20,
      "task_idx": 273,
      "tf": 10.0,
      "pe": 7.8,
      "ecs": 10.0,
      "success": true,
      "failure_category": "",
      "prompt_tokens": null,
      "completion_tokens": null,
      "wall_clock_s": 1079.541,
      "task_status": "affected",
      "model": "gpt-4o-mini",
      "judge": "gpt-4o-mini",
      "mcp_status_at_start": {
        "observed_servers": 26,
        "connected_servers": 26,
        "available_tools": 304
      }
    },
    {
      "strategy": "full_rewrite",
      "version": "early",
      "run_id": 20,
      "task_idx": 28,
      "tf": 3.6,
      "pe": 4.8,
      "ecs": 2.691547622518193,
      "success": false,
      "failure_category": "unknown",
      "prompt_tokens": null,
      "completion_tokens": null,
      "wall_clock_s": 1079.541,
      "task_status": "affected",
      "model": "gpt-4o-mini",
      "judge": "gpt-4o-mini",
      "mcp_status_at_start": {
        "observed_servers": 26,
        "connected_servers": 26,
        "available_tools": 304
      }
    },
    {
      "strategy": "full_rewrite",
      "version": "early",
      "run_id": 20,
      "task_idx": 281,
      "tf": 10.0,
      "pe": 4.8,
      "ecs": 9.356209716700507,
      "success": true,
      "failure_category": "",
      "prompt_tokens": null,
      "completion_tokens": null,
      "wall_clock_s": 1079.541,
      "task_status": "affected",
      "model": "gpt-4o-mini",
      "judge": "gpt-4o-mini",
      "mcp_status_at_start": {
        "observed_servers": 26,
        "connected_servers": 26,
        "available_tools": 304
      }
    },
    {
      "strategy": "full_rewrite",
      "version": "early",
      "run_id": 20,
      "task_idx": 289,
      "tf": 6.8,
      "pe": 6.8,
      "ecs": 6.358172200135366,
      "success": true,
      "failure_category": "",
      "prompt_tokens": null,
      "completion_tokens": null,
      "wall_clock_s": 1079.541,
      "task_status": "affected",
      "model": "gpt-4o-mini",
      "judge": "gpt-4o-mini",
      "mcp_status_at_start": {
        "observed_servers": 26,
        "connected_servers": 26,
        "available_tools": 304
      }
    },
    {
      "strategy": "full_rewrite",
      "version": "early",
      "run_id": 20,
      "task_idx": 291,
      "tf": 10.0,
      "pe": 8.2,
      "ecs": 10.0,
      "success": true,
      "failure_category": "",
      "prompt_tokens": null,
      "completion_tokens": null,
      "wall_clock_s": 1079.541,
      "task_status": "retention",
      "model": "gpt-4o-mini",
      "judge": "gpt-4o-mini",
      "mcp_status_at_start": {
        "observed_servers": 26,
        "connected_servers": 26,
        "available_tools": 304
      }
    },
    {
      "strategy": "full_rewrite",
      "version": "early",
      "run_id": 20,
      "task_idx": 34,
      "tf": 9.0,
      "pe": 4.4,
      "ecs": 8.772385762508462,
      "success": true,
      "failure_category": "",
      "prompt_tokens": null,
      "completion_tokens": null,
      "wall_clock_s": 1079.541,
      "task_status": "affected",
      "model": "gpt-4o-mini",
      "judge": "gpt-4o-mini",
      "mcp_status_at_start": {
        "observed_servers": 26,
        "connected_servers": 26,
        "available_tools": 304
      }
    },
    {
      "strategy": "full_rewrite",
      "version": "early",
      "run_id": 20,
      "task_idx": 358,
      "tf": 3.6,
      "pe": 2.8,
      "ecs": 3.5867973981876284,
      "success": false,
      "failure_category": "unknown",
      "prompt_tokens": null,
      "completion_tokens": null,
      "wall_clock_s": 1079.541,
      "task_status": "affected",
      "model": "gpt-4o-mini",
      "judge": "gpt-4o-mini",
      "mcp_status_at_start": {
        "observed_servers": 26,
        "connected_servers": 26,
        "available_tools": 304
      }
    },
    {
      "strategy": "full_rewrite",
      "version": "early",
      "run_id": 20,
      "task_idx": 385,
      "tf": 10.0,
      "pe": 8.2,
      "ecs": 10.0,
      "success": true,
      "failure_category": "",
      "prompt_tokens": null,
      "completion_tokens": null,
      "wall_clock_s": 1079.541,
      "task_status": "affected",
      "model": "gpt-4o-mini",
      "judge": "gpt-4o-mini",
      "mcp_status_at_start": {
        "observed_servers": 26,
        "connected_servers": 26,
        "available_tools": 304
      }
    },
    {
      "strategy": "full_rewrite",
      "version": "early",
      "run_id": 20,
      "task_idx": 386,
      "tf": 10.0,
      "pe": 10.0,
      "ecs": 10.0,
      "success": true,
      "failure_category": "",
      "prompt_tokens": null,
      "completion_tokens": null,
      "wall_clock_s": 1079.541,
      "task_status": "affected",
      "model": "gpt-4o-mini",
      "judge": "gpt-4o-mini",
      "mcp_status_at_start": {
        "observed_servers": 26,